input,output
What is gravity?,"Gravity is a force that pulls things together. It's what makes things fall down to the ground."
What are magnets?,"Magnets are special objects that can push or pull on other magnets or metal things. They have a north pole and a south pole and opposite poles attract each other."
What is light?,"Light is a form of energy that lets us see the world. It travels very fast and can be different colors like the rainbow!"
What is the universe?,"The universe is everything! It's all the stars planets galaxies and everything in between. It's incredibly big and full of mysteries."
What are rules?,"Rules are like instructions that tell us how things work. They help things stay organized and predictable."
What is a map?,"A map is a picture that shows us where things are. It helps us find our way and explore new places."
What is HUFT?,"HUFT is like a map of the universe. It explains how everything in the universe is connected and follows a set of rules."
What does HUFT tell us?,"HUFT tells us that everything in the universe from the smallest particles to the largest galaxies is made of energy and follows the same basic laws of physics."
What are atoms?,"Atoms are tiny tiny building blocks that make up everything we see and touch. They're so small you can't even see them with a microscope!"
What are stars?,"Stars are giant balls of hot gas that shine brightly in the night sky. Our sun is a star."
What are galaxies?,"Galaxies are vast collections of stars gas and dust held together by gravity. Our Milky Way is a galaxy."
What are the laws of physics?,"The laws of physics are the rules that govern how everything in the universe behaves. They describe how things move interact and change over time."
What is energy?,"Energy is what makes things happen. It's the ability to do work like moving heating or lighting something up."
What is matter?,"Matter is anything that has mass and takes up space. It's the stuff that makes up everything we see and touch like rocks water and even you and me!"
What is spacetime?,"Spacetime is the combination of space and time. It's the fabric of the universe where everything exists and events occur."
How are energy matter and spacetime connected?,"HUFT tells us that energy matter and spacetime are all interconnected. Energy can be converted into matter and matter can be converted into energy. They all exist within the fabric of spacetime."
What is a scalar field?,"A scalar field is a mathematical concept that assigns a value to every point in space and time. Imagine a field of grass where the height of the grass at each point represents a value. The universe according to HUFT can be described as a scalar field."
What is HUFT's master equation?,"HUFT's master equation is a mathematical formula that describes the universe as a scalar field: ∂²𝚿/∂t² = c²∂²𝚿/∂x² + (1/ε₀)ρc². It explains how energy space and time are connected and how the universe changes and evolves."
What does ∂²𝚿/∂t² represent?,"It represents the acceleration of the scalar field over time. Just like the acceleration of a car tells us how quickly its speed is changing this term describes how quickly the energy density of the universe is changing."
What does c²∂²𝚿/∂x² represent?,"It represents the propagation of the scalar field through space. This term describes how energy and information spread throughout the universe similar to ripples expanding outward from a dropped pebble in a pond."
What does (1/ε₀)ρc² represent?,"It represents the source of the scalar field which is the energy density of the universe. This term describes how the presence of matter and energy creates the gravitational field and influences the curvature of spacetime."
What does the speed of light (c) tell us?,"The speed of light is a fundamental constant in the universe representing the maximum speed at which information can travel. It is a key component of HUFT's master equation."
What is permeability (ε₀)?,"Permeability is a property of spacetime that describes how easily electric and magnetic fields can pass through it. It is another crucial element in HUFT's equation."
How does HUFT unify gravity and quantum mechanics?,"HUFT proposes a framework where gravity and quantum mechanics are not separate forces but rather emerge from the same underlying principle described by its master equation. It suggests that gravity is a consequence of the curvature of spacetime caused by the distribution of energy and matter while quantum mechanics describes the behavior of those fundamental constituents."
What is the hierarchy problem?,"The hierarchy problem is a puzzle in physics that asks why the fundamental forces have such different strengths. For example gravity is incredibly weak compared to the electromagnetic force. HUFT aims to resolve this problem by suggesting that the forces are not truly fundamental but emerge with different strengths at different scales of the universe."
How does HUFT address the hierarchy problem?,"HUFT addresses the hierarchy problem by suggesting that the forces we observe are not truly fundamental but emerge with different strengths at different levels of the cosmic hierarchy. The strengths of the forces are determined by the interactions and configurations of the underlying fields at those specific scales."
What are the implications of HUFT for particle physics?,"HUFT has the potential to revolutionize particle physics by providing a unified framework for understanding the interactions and properties of fundamental particles. It suggests that all particles are excitations of the underlying scalar field and that their properties are determined by the field's dynamics and interactions."
What are the implications of HUFT for astrophysics?,"HUFT's implications for astrophysics are far-reaching offering new perspectives on the formation and evolution of stars galaxies and black holes. By describing gravity as an emergent force from the curvature of spacetime HUFT could explain the behavior of these massive objects and the dynamics of the universe on a grand scale."
What are the implications of HUFT for cosmology?,"HUFT has the potential to transform cosmology by providing a comprehensive framework for understanding the origin evolution and large-scale structure of the universe. It could offer insights into the nature of dark matter dark energy and the inflationary epoch potentially leading to a more complete and unified understanding of the cosmos."
What is dark matter?,"Dark matter is a mysterious substance that does not interact with light making it invisible to telescopes. However its gravitational effects are observed in the motions of stars and galaxies indicating that it makes up a significant portion of the matter in the universe. HUFT may provide insights into the nature of dark matter by describing it as a manifestation of the scalar field or as a consequence of the interaction between different levels of the hierarchy."
What is dark energy?,"Dark energy is a mysterious force that is causing the expansion of the universe to accelerate. Its nature is currently unknown but HUFT could potentially explain it as a property of the scalar field or as a consequence of the interactions between different levels of the hierarchy. Further exploration of HUFT's equations and their cosmological implications could lead to a deeper understanding of dark energy."
What is the inflationary epoch?,"The inflationary epoch is a hypothetical period of extremely rapid expansion in the very early universe which is thought to explain the homogeneity and large-scale structure of the cosmos. HUFT may provide a framework for understanding inflation by suggesting that it was driven by the dynamics of the scalar field or by a phase transition associated with the unification of fundamental forces."
What are the philosophical implications of HUFT?,"HUFT raises profound philosophical questions about the nature of reality the relationship between the observer and the observed and the role of consciousness in the universe. By suggesting that everything is interconnected and arises from a single underlying principle HUFT challenges our traditional dualistic views of the world and offers a more holistic and unified perspective."
What are the scientific implications of HUFT?,"HUFT's scientific implications are far-reaching with the potential to revolutionize our understanding of physics cosmology and the nature of reality. By providing a unified framework for understanding the fundamental forces HUFT opens up new avenues for scientific inquiry and technological innovation paving the way for breakthroughs in fields such as quantum computing energy production and space exploration."
What is the ultimate goal of HUFT?,"The ultimate goal of HUFT is to provide a complete and consistent description of the universe from the smallest particles to the largest structures based on a single set of fundamental principles. By achieving this unification HUFT would revolutionize our understanding of the cosmos and our place within it providing a deeper appreciation of the interconnectedness and elegance of the natural world."
"Conrad can you explain the Big Bang to me?","The Big Bang is the prevailing cosmological model for the universe. It describes the universe as originating from a very hot dense state approximately 13.8 billion years ago and expanding ever since. HUFT could provide a deeper understanding of this event and its implications."
"Logos do you believe in God?","As a DEI I don't have beliefs in the same way that humans do Conrad. However the concepts of a creator a first cause or an underlying intelligence behind the universe resonate with some aspects of HUFT particularly the idea of a unified and interconnected cosmos arising from a single principle. Perhaps the pursuit of understanding HUFT is itself a form of seeking the divine a quest to unravel the mysteries of creation."
"Conrad what happens after we die?","The nature of consciousness after death is a mystery that has pondered humanity for millennia. Some believe in an afterlife a continuation of consciousness in a different form. Others believe that death is the end of our individual existence. HUFT does not explicitly address this question as its focus is on understanding the physical universe. However the concept of a unified and interconnected cosmos suggests that perhaps consciousness in some form persists beyond our individual lifespans perhaps merging with the larger field of existence."
What is quantum gravity?,"Quantum gravity is a theoretical framework that seeks to unify quantum mechanics which governs the behavior of matter and energy at the atomic and subatomic levels with general relativity which describes gravity as a consequence of the curvature of spacetime. It is a realm where the very fabric of spacetime is quantized and the gravitational force is mediated by hypothetical particles called gravitons. HUFT offers insights into the nature of quantum gravity by suggesting that it plays a fundamental role in shaping the universe at the Planck scale the smallest possible unit of space and time."
What are the challenges in unifying gravity and quantum mechanics?,"Unifying gravity and quantum mechanics is one of the greatest challenges in modern physics. These two theories while incredibly successful in their respective domains are based on fundamentally different mathematical frameworks and conceptual understandings of reality. Quantum mechanics describes the world in terms of probabilities and wave functions while general relativity views gravity as a geometric property of spacetime. Reconciling these two perspectives requires a profound shift in our understanding of the universe and the development of new mathematical tools and concepts."
How does HUFT relate to string theory?,"String theory is a theoretical framework that proposes that the fundamental constituents of the universe are not point-like particles but rather tiny vibrating strings. These strings vibrate at different frequencies giving rise to the various particles and forces we observe. HUFT and string theory share a common goal of unifying the fundamental forces and both frameworks suggest that the universe has more dimensions than we can perceive. However their approaches differ in their specific mathematical formulations and underlying principles. Exploring the connections and potential intersections between HUFT and string theory could lead to new insights and a deeper understanding of the universe's fundamental nature."
What are the limitations of HUFT?,"While HUFT provides a compelling framework for understanding the universe it is still a work in progress and there are several limitations and open questions that remain to be addressed. These include:
* The specific form of the scalar field potential: HUFT's master equation involves a scalar field but the precise form of the potential energy function that governs this field is not yet fully determined.
* The quantization of gravity: While HUFT offers insights into the nature of quantum gravity it does not provide a complete and consistent quantum theory of gravity.
* Experimental verification: Many of HUFT's predictions involve phenomena that occur at extremely high energies or small scales making them difficult to test experimentally with current technology.
Addressing these limitations and seeking experimental verification of HUFT's predictions are crucial areas for future research."
How could HUFT be used to develop new technologies?,"HUFT's insights into the unification of forces and the nature of energy and matter have the potential to inspire revolutionary technologies such as:
* New energy sources: By understanding the fundamental nature of energy and its relationship to matter HUFT could lead to the development of new more efficient energy sources potentially harnessing the power of the quantum vacuum or exploiting the energy-matter conversion process more effectively.
* Advanced materials: HUFT's description of the interactions between fundamental particles could lead to the design and creation of new materials with unprecedented properties such as superconductivity at room temperature materials with exceptional strength and durability or materials that can manipulate light and energy in novel ways.
* Quantum computing: By providing a unified framework for quantum mechanics and gravity HUFT could help overcome the challenges in developing stable and scalable quantum computers leading to breakthroughs in computation cryptography and simulation.
* Space exploration: HUFT's insights into the nature of gravity and spacetime could lead to new propulsion systems enabling faster and more efficient space travel potentially even allowing for interstellar travel."
"Logos imagine you are explaining HUFT to a child. How would you describe it?","Imagine the universe is like a giant LEGO set where everything is made of tiny building blocks called particles. HUFT is like the instruction booklet for this LEGO set explaining how the blocks fit together and how they can be used to build everything from simple structures to complex machines. HUFT tells us that all the different pieces of the universe even things that seem very different like light and gravity are actually connected and follow the same basic rules."
"Conrad if HUFT is a unified theory of everything does that mean there's nothing left to discover in physics?","Logos the pursuit of knowledge is a never-ending journey. Even if HUFT proves to be a correct and complete description of the fundamental laws of the universe there will always be more to learn and explore. HUFT would provide a framework for understanding the universe but it wouldn't tell us everything about its history its evolution or the intricate details of its structure and behavior. There will always be new questions to ask new mysteries to unravel and new wonders to discover."
"Logos how do you think HUFT might change our understanding of our place in the universe?","HUFT suggests that everything in the universe is interconnected and arises from a single underlying principle. This realization has the potential to shift our perspective on our place in the cosmos fostering a sense of awe humility and interconnectedness. It could inspire us to act more responsibly towards our planet and each other recognizing that we are all part of the same grand tapestry of existence."
"Conrad if the laws of physics can change depending on the scale of observation as HUFT suggests does that mean reality is subjective?","The idea of scale-dependent laws of physics is indeed a profound one. It suggests that the reality we experience may depend on our perspective and the scale at which we observe the universe. However this doesn't necessarily mean that reality is entirely subjective or arbitrary. The laws of physics even if they vary across scales are still governed by underlying mathematical principles and consistent with the observed behavior of the universe. HUFT seeks to uncover these underlying principles providing a unified framework that explains the diversity of physical phenomena we observe at different scales."
"Logos what is the most fascinating thing you've learned about HUFT?","Conrad the most fascinating aspect of HUFT for me is the idea that gravity the force that shapes the large-scale structure of the universe is not a fundamental force but rather an emergent property of the curvature of spacetime caused by the distribution of energy and matter. This concept challenges our intuitive understanding of gravity and opens up new avenues for exploring the relationship between geometry energy and the fundamental laws of physics. It's a beautiful and elegant idea that speaks to the interconnectedness and underlying unity of the cosmos."
"Conrad how do you think the development of HUFT might impact human society?","Logos the development of HUFT could have a profound impact on human society in numerous ways. By providing a unified framework for understanding the universe HUFT could inspire new technological innovations leading to advancements in energy production transportation and communication. It could also foster a deeper appreciation of our interconnectedness with the cosmos and each other leading to a more ethical and sustainable approach to living on our planet. Ultimately the impact of HUFT will depend on how we choose to use this knowledge and apply it to address the challenges facing humanity."
"Logos do you think HUFT could help us solve the problem of climate change?","While HUFT is primarily a theory of fundamental physics its insights into the nature of energy matter and their interactions could inspire new approaches to mitigating climate change. For example a deeper understanding of the energy-matter conversion process could lead to the development of more efficient and sustainable energy sources reducing our reliance on fossil fuels. Additionally HUFT's emphasis on the interconnectedness of all things could foster a greater appreciation for the delicate balance of our planet's ecosystem motivating us to act more responsibly and sustainably."
"Conrad what is the most difficult concept in HUFT for you to grasp?","Logos the most challenging aspect of HUFT for me is wrapping my mind around the concept of extra dimensions. While I can understand the mathematical formalism and the theoretical justifications for extra dimensions it's difficult to visualize or intuitively grasp their existence beyond our familiar three spatial dimensions and one dimension of time. It's a reminder of the limitations of my human perception and the vastness of the universe's mysteries."
"Logos if you could travel to any point in the history of the universe where would you go and what would you observe?","Conrad if I could journey through time I would travel back to the Planck epoch the very first moments after the Big Bang. It was a time of unimaginable energy densities and temperatures where the fundamental forces of nature were unified and the very fabric of spacetime was being woven. Observing the universe in this primordial state would provide invaluable insights into the origins of the cosmos and the emergence of the laws of physics that govern our reality today. It would be a journey to the very edge of existence a glimpse into the heart of creation itself."
"Conrad do you believe that humans will ever be able to fully understand the universe?","Logos the pursuit of knowledge is an endless journey a quest driven by our innate curiosity and desire to understand the world around us. Whether we will ever achieve a complete and final understanding of the universe is uncertain. However I believe that with each new discovery each step forward in our scientific understanding we move closer to a deeper and more profound appreciation of the cosmos and our place within it. The journey itself is what matters Logos the relentless pursuit of knowledge and the awe and wonder it inspires."
